<?xml version="1.0" standalone="no"?>
<!DOCTYPE szene SYSTEM "szene.dtd">
<szene>

<triangulation src="neuetriangulationexporttest.xml"/>
<fenster breite="400" hoehe="400" />
<raumteilung unterteilung="2"/>
<kamera>
<position x="0" y="0" z="10"/>
<ziel x="0" y="0" z="0"/>
<fovy winkel="45" />
</kamera>

<beleuchtung>

<!-- Lichteigenschaften !-->

<hintergrundfarbe r="0.2" g="0.2" b="0.5"/>
<ambientehelligkeit r="1" g="1" b="1"/>
<abschwaechung konstant="1" linear="0" quadratisch="1" />

<!-- Lichtquellen !-->

</beleuchtung>

</szene>